{
  "schemaVersion": "1.0.0",
  "id": "entangled-branch",
  "japaneseName": "絡み枝",
  "japaneseAliases": [],
  "englishName": null,
  "slug": "entangled-branch",
  "category": "relationship",
  "definition": "書籍では交差枝と同一見出しで扱われ、枝同士が交差して絡む状態として説明される枝。交差枝との厳密な区別は記載されていない。",
  "characteristics": [
    "枝同士が互いの進路へ入り込み、絡む。",
    "接触による傷や、成長後の癒着につながる場合がある。"
  ],
  "whyRemove": [
    "枝同士の接触で傷つく場合がある。",
    "成長後に癒着すると処理が難しくなる。"
  ],
  "pruningMethod": {
    "summary": "交差枝と同じ項目の指針に従い、将来の生長を見据えて一方を残し、もう一方をつけ根から間引く。",
    "cutPosition": "除去する枝のつけ根。",
    "steps": [
      "絡みの原因になった枝の流れを確認する。",
      "残す枝を将来の生長から判断する。",
      "不要な一方をつけ根から間引く。"
    ]
  },
  "pruningPriority": "unknown",
  "exceptions": [
    "生け垣などで空いた部分を塞ぐため、隣の枝を引っ張って使う場合がある。"
  ],
  "applicablePlants": [],
  "cautions": [
    "交差枝との用語上の区別は書籍画像から確定できない。",
    "細い方、新しい方という理由だけで機械的に切らない。"
  ],
  "imageGuidance": {
    "description": "複数の枝が互いの間を縫うように入り込み、接触または絡み合う状態を示す。",
    "keyElements": [
      "互いに入り込む枝",
      "接触点",
      "将来癒着し得る部分",
      "間引く枝のつけ根"
    ],
    "sourceBasis": "combined",
    "mediaReferences": []
  },
  "source": [
    {
      "sourceId": "book-002",
      "bookTitle": "剪定「コツ」の教科書",
      "author": "木下透",
      "imageFileName": "Imieda-6.JPG",
      "page": 67,
      "extractionTypes": ["body", "photo", "caption"],
      "note": "書籍では「交差枝、絡み枝」を同一番号で併記。"
    }
  ],
  "reviewStatus": "draft",
  "notes": [
    "交差枝とは同一見出しだが、同義語とは断定せず別IDにした。"
  ]
}
